{
  "schemaVersion": 1,
  "reviewVersion": "legacy-taxonomy-review-v1",
  "rawInventoryManifestPayloadSha256": "306abbeaf9775e9a00efc4278f3841fa35a9e825d34c356a6ad902fe1d2cb522",
  "decisions": [
    {
      "namespace": "blog_category",
      "rawValue": "devlog",
      "disposition": "merge",
      "targetId": "software",
      "supplementalTagIds": [],
      "rationale": "category_repartition"
    },
    {
      "namespace": "blog_category",
      "rawValue": "diary",
      "disposition": "merge",
      "targetId": "robotics",
      "supplementalTagIds": [],
      "rationale": "category_repartition"
    },
    {
      "namespace": "blog_category",
      "rawValue": "infra",
      "disposition": "merge",
      "targetId": "infrastructure",
      "supplementalTagIds": [],
      "rationale": "semantic_merge"
    },
    {
      "namespace": "blog_category",
      "rawValue": "network",
      "disposition": "merge",
      "targetId": "infrastructure",
      "supplementalTagIds": [
        "network"
      ],
      "rationale": "category_repartition"
    },
    {
      "namespace": "note_subject",
      "rawValue": "infrastructure",
      "disposition": "active",
      "targetId": "infrastructure",
      "supplementalTagIds": [],
      "rationale": "canonical"
    },
    {
      "namespace": "tag",
      "rawValue": "AnythingLLM",
      "disposition": "active",
      "targetId": "anythingllm",
      "supplementalTagIds": [],
      "rationale": "canonical"
    },
    {
      "namespace": "tag",
      "rawValue": "Astro",
      "disposition": "active",
      "targetId": "astro",
      "supplementalTagIds": [],
      "rationale": "canonical"
    },
    {
      "namespace": "tag",
      "rawValue": "Docker",
      "disposition": "active",
      "targetId": "docker",
      "supplementalTagIds": [],
      "rationale": "canonical"
    },
    {
      "namespace": "tag",
      "rawValue": "Firebase",
      "disposition": "active",
      "targetId": "firebase",
      "supplementalTagIds": [],
      "rationale": "canonical"
    },
    {
      "namespace": "tag",
      "rawValue": "Firestore",
      "disposition": "active",
      "targetId": "firestore",
      "supplementalTagIds": [],
      "rationale": "canonical"
    },
    {
      "namespace": "tag",
      "rawValue": "Go",
      "disposition": "active",
      "targetId": "go",
      "supplementalTagIds": [],
      "rationale": "canonical"
    },
    {
      "namespace": "tag",
      "rawValue": "LuaLaTeX",
      "disposition": "active",
      "targetId": "lualatex",
      "supplementalTagIds": [],
      "rationale": "canonical"
    },
    {
      "namespace": "tag",
      "rawValue": "MDX",
      "disposition": "active",
      "targetId": "mdx",
      "supplementalTagIds": [],
      "rationale": "canonical"
    },
    {
      "namespace": "tag",
      "rawValue": "Pandoc",
      "disposition": "active",
      "targetId": "pandoc",
      "supplementalTagIds": [],
      "rationale": "canonical"
    },
    {
      "namespace": "tag",
      "rawValue": "PostgreSQL",
      "disposition": "active",
      "targetId": "postgresql",
      "supplementalTagIds": [],
      "rationale": "canonical"
    },
    {
      "namespace": "tag",
      "rawValue": "PowerShell",
      "disposition": "active",
      "targetId": "powershell",
      "supplementalTagIds": [],
      "rationale": "canonical"
    },
    {
      "namespace": "tag",
      "rawValue": "Python",
      "disposition": "active",
      "targetId": "python",
      "supplementalTagIds": [],
      "rationale": "canonical"
    },
    {
      "namespace": "tag",
      "rawValue": "Qdrant",
      "disposition": "active",
      "targetId": "qdrant",
      "supplementalTagIds": [],
      "rationale": "canonical"
    },
    {
      "namespace": "tag",
      "rawValue": "RAG",
      "disposition": "active",
      "targetId": "rag",
      "supplementalTagIds": [],
      "rationale": "canonical"
    },
    {
      "namespace": "tag",
      "rawValue": "React",
      "disposition": "active",
      "targetId": "react",
      "supplementalTagIds": [],
      "rationale": "canonical"
    },
    {
      "namespace": "tag",
      "rawValue": "TEI",
      "disposition": "active",
      "targetId": "tei",
      "supplementalTagIds": [],
      "rationale": "canonical"
    },
    {
      "namespace": "tag",
      "rawValue": "Tailwind CSS",
      "disposition": "active",
      "targetId": "tailwind-css",
      "supplementalTagIds": [],
      "rationale": "canonical"
    },
    {
      "namespace": "tag",
      "rawValue": "TypeScript",
      "disposition": "active",
      "targetId": "typescript",
      "supplementalTagIds": [],
      "rationale": "canonical"
    },
    {
      "namespace": "tag",
      "rawValue": "WSL",
      "disposition": "active",
      "targetId": "wsl",
      "supplementalTagIds": [],
      "rationale": "canonical"
    },
    {
      "namespace": "tag",
      "rawValue": "ai",
      "disposition": "active",
      "targetId": "ai",
      "supplementalTagIds": [],
      "rationale": "canonical"
    },
    {
      "namespace": "tag",
      "rawValue": "analysis",
      "disposition": "active",
      "targetId": "analysis",
      "supplementalTagIds": [],
      "rationale": "canonical"
    },
    {
      "namespace": "tag",
      "rawValue": "anythingllm",
      "disposition": "alias",
      "targetId": "anythingllm",
      "supplementalTagIds": [],
      "rationale": "spelling_variant"
    },
    {
      "namespace": "tag",
      "rawValue": "astro",
      "disposition": "alias",
      "targetId": "astro",
      "supplementalTagIds": [],
      "rationale": "spelling_variant"
    },
    {
      "namespace": "tag",
      "rawValue": "benchmark",
      "disposition": "active",
      "targetId": "benchmark",
      "supplementalTagIds": [],
      "rationale": "canonical"
    },
    {
      "namespace": "tag",
      "rawValue": "calculation",
      "disposition": "retire",
      "supplementalTagIds": [],
      "rationale": "redundant_metadata"
    },
    {
      "namespace": "tag",
      "rawValue": "ci-cd",
      "disposition": "active",
      "targetId": "ci-cd",
      "supplementalTagIds": [],
      "rationale": "canonical"
    },
    {
      "namespace": "tag",
      "rawValue": "cli",
      "disposition": "active",
      "targetId": "cli",
      "supplementalTagIds": [],
      "rationale": "canonical"
    },
    {
      "namespace": "tag",
      "rawValue": "codex",
      "disposition": "active",
      "targetId": "codex",
      "supplementalTagIds": [],
      "rationale": "canonical"
    },
    {
      "namespace": "tag",
      "rawValue": "conoha-vps",
      "disposition": "active",
      "targetId": "conoha-vps",
      "supplementalTagIds": [],
      "rationale": "canonical"
    },
    {
      "namespace": "tag",
      "rawValue": "cpu",
      "disposition": "active",
      "targetId": "cpu",
      "supplementalTagIds": [],
      "rationale": "canonical"
    },
    {
      "namespace": "tag",
      "rawValue": "debugging",
      "disposition": "active",
      "targetId": "debugging",
      "supplementalTagIds": [],
      "rationale": "canonical"
    },
    {
      "namespace": "tag",
      "rawValue": "docker",
      "disposition": "alias",
      "targetId": "docker",
      "supplementalTagIds": [],
      "rationale": "spelling_variant"
    },
    {
      "namespace": "tag",
      "rawValue": "firebase",
      "disposition": "alias",
      "targetId": "firebase",
      "supplementalTagIds": [],
      "rationale": "spelling_variant"
    },
    {
      "namespace": "tag",
      "rawValue": "gale",
      "disposition": "active",
      "targetId": "gale",
      "supplementalTagIds": [],
      "rationale": "canonical"
    },
    {
      "namespace": "tag",
      "rawValue": "github-actions",
      "disposition": "active",
      "targetId": "github-actions",
      "supplementalTagIds": [],
      "rationale": "canonical"
    },
    {
      "namespace": "tag",
      "rawValue": "go",
      "disposition": "alias",
      "targetId": "go",
      "supplementalTagIds": [],
      "rationale": "spelling_variant"
    },
    {
      "namespace": "tag",
      "rawValue": "gpu",
      "disposition": "active",
      "targetId": "gpu",
      "supplementalTagIds": [],
      "rationale": "canonical"
    },
    {
      "namespace": "tag",
      "rawValue": "homebrew",
      "disposition": "active",
      "targetId": "homebrew",
      "supplementalTagIds": [],
      "rationale": "canonical"
    },
    {
      "namespace": "tag",
      "rawValue": "homelab",
      "disposition": "active",
      "targetId": "homelab",
      "supplementalTagIds": [],
      "rationale": "canonical"
    },
    {
      "namespace": "tag",
      "rawValue": "latex",
      "disposition": "active",
      "targetId": "latex",
      "supplementalTagIds": [],
      "rationale": "canonical"
    },
    {
      "namespace": "tag",
      "rawValue": "math",
      "disposition": "active",
      "targetId": "math",
      "supplementalTagIds": [],
      "rationale": "canonical"
    },
    {
      "namespace": "tag",
      "rawValue": "matplotlib",
      "disposition": "active",
      "targetId": "matplotlib",
      "supplementalTagIds": [],
      "rationale": "canonical"
    },
    {
      "namespace": "tag",
      "rawValue": "mdx",
      "disposition": "alias",
      "targetId": "mdx",
      "supplementalTagIds": [],
      "rationale": "spelling_variant"
    },
    {
      "namespace": "tag",
      "rawValue": "migration",
      "disposition": "active",
      "targetId": "migration",
      "supplementalTagIds": [],
      "rationale": "canonical"
    },
    {
      "namespace": "tag",
      "rawValue": "operations",
      "disposition": "active",
      "targetId": "operations",
      "supplementalTagIds": [],
      "rationale": "canonical"
    },
    {
      "namespace": "tag",
      "rawValue": "pandas",
      "disposition": "active",
      "targetId": "pandas",